<?xml version="1.0" encoding="euc-kr"?>

<!-- 루트 엘리먼트 선언 -->
<!ELEMENT booklist (book*)>
  <!ELEMENT book (title, author, publisher)>
    <!ELEMENT title (#PCDATA)>
    <!ELEMENT author (#PCDATA|name)*>
			<!ELEMENT name (#PCDATA)>
	  <!ELEMENT publisher (#PCDATA)>
		<!ELEMENT image EMPTY>

